### ISSUE TITLE
Users using SASL while already authenticated are first logged out before being logged in

### ISSUE THREAD

**Issue by progval** [atheme/atheme#952]
This causes various IRCds to send incorrect numerics.

# InspIRCd

```
1769255063.776 1 -> S: AUTHENTICATE PLAIN
1769255065.777 1 -> S: PING synchronize829877.308338147
1769255065.777 S -> 1: AUTHENTICATE :+
1769255065.777 S -> 1: :My.Little.Server PONG My.Little.Server :synchronize829877.308338147
1769255065.777 1 -> S: AUTHENTICATE amlsbGVzAGppbGxlcwBzZXNhbWU=
1769255065.810 S -> 1: :My.Little.Server 901 user user!username@127.0.0.1 :You are now logged out
1769255065.810 S -> 1: :SaslServ!saslserv@services.int NOTICE user :Last login from: r@127.0.0.1 on Jan 24 12:44:24 2026 +0100.
1769255065.810 S -> 1: :My.Little.Server 900 user user!username@127.0.0.1 jilles :You are now logged in as jilles
1769255065.810 S -> 1: :My.Little.Server 903 user :SASL authentication successful
```

```
12:44:23.776471 IP localhost.39794 > localhost.51063: Flags [P.], seq 182:202, ack 2239, win 605, options [nop,nop,TS val 3233051687 ecr 3233051687], length 20
E..H.<@.@."r.........r.w...........].<.....
..t'..t'AUTHENTICATE PLAIN

12:44:23.776516 IP localhost.33009 > localhost.58332: Flags [P.], seq 2162:2258, ack 1541, win 504, options [nop,nop,TS val 3233051687 ecr 3233051642], length 96
E.....@.@.(..............w.+^.6............
..t'..s.:000 ENCAP 00A SASL 000AAAAAE * H 127.0.0.1 127.0.0.1 P
:000 ENCAP 00A SASL 000AAAAAE * S PLAIN

12:44:23.780349 IP localhost.58332 > localhost.33009: Flags [P.], seq 1541:1586, ack 2258, win 502, options [nop,nop,TS val 3233051691 ecr 3233051687], length 45
E..arm@.@..'............^.6..w.......U.....
..t+..t':00A ENCAP 000 SASL 00AAAAAAC 000AAAAAE C +

12:44:23.780357 IP localhost.33009 > localhost.58332: Flags [.], ack 1586, win 504, options [nop,nop,TS val 3233051691 ecr 3233051691], length 0
E..4..@.@.(..............w..^.7%.....(.....
..t+..t+
12:44:23.780400 IP localhost.51063 > localhost.39794: Flags [P.], seq 2239:2256, ack 202, win 512, options [nop,nop,TS val 3233051691 ecr 3233051687], length 17
E..E..@.@............w.r.......B.....9.....
..t+..t'AUTHENTICATE :+

12:44:23.824318 IP localhost.39794 > localhost.51063: Flags [.], ack 2256, win 605, options [nop,nop,TS val 3233051735 ecr 3233051691], length 0
E..4.=@.@."..........r.w...B.......].(.....
..tW..t+
12:44:25.776666 IP localhost.39794 > localhost.51063: Flags [P.], seq 202:236, ack 2256, win 605, options [nop,nop,TS val 3233053687 ecr 3233051691], length 34
E..V.>@.@."b.........r.w...B.......].J.....
..{...t+PING synchronize829877.308338147

12:44:25.776732 IP localhost.51063 > localhost.39794: Flags [P.], seq 2256:2326, ack 236, win 512, options [nop,nop,TS val 3233053687 ecr 3233053687], length 70
E..z..@.@............w.r.......d.....n.....
..{...{.:My.Little.Server PONG My.Little.Server :synchronize829877.308338147

12:44:25.776739 IP localhost.39794 > localhost.51063: Flags [.], ack 2326, win 605, options [nop,nop,TS val 3233053687 ecr 3233053687], length 0
E..4.?@.@."..........r.w...d...&...].(.....
..{...{.
12:44:25.776817 IP localhost.39794 > localhost.51063: Flags [P.], seq 236:279, ack 2326, win 605, options [nop,nop,TS val 3233053687 ecr 3233053687], length 43
E.._.@@.@."W.........r.w...d...&...].S.....
..{...{.AUTHENTICATE amlsbGVzAGppbGxlcwBzZXNhbWU=

12:44:25.776851 IP localhost.33009 > localhost.58332: Flags [P.], seq 2258:2329, ack 1586, win 504, options [nop,nop,TS val 3233053687 ecr 3233051691], length 71
E..{..@.@.(..............w..^.7%.....o.....
..{...t+:000 ENCAP 00A SASL 000AAAAAE 00AAAAAAC C amlsbGVzAGppbGxlcwBzZXNhbWU=

12:44:25.809515 IP localhost.58332 > localhost.33009: Flags [P.], seq 1586:1844, ack 2329, win 502, options [nop,nop,TS val 3233053720 ecr 3233053687], length 258
E..6rn@.@..Q............^.7%.w.......*.....
..|...{.:00A METADATA 000AAAAAE accountid :
:00A METADATA 000AAAAAE accountname :
:00AAAAAAC NOTICE 000AAAAAE :Last login from: .r@127.0.0.1. on Jan 24 12:44:24 2026 +0100.
:00A METADATA 000AAAAAE accountname :jilles
:00A ENCAP 000 SASL 00AAAAAAC 000AAAAAE D S

12:44:25.809525 IP localhost.33009 > localhost.58332: Flags [.], ack 1844, win 502, options [nop,nop,TS val 3233053720 ecr 3233053720], length 0
E..4..@.@.(..............w..^.8'.....(.....
..|...|.
12:44:25.809604 IP localhost.51063 > localhost.39794: Flags [P.], seq 2326:2662, ack 279, win 512, options [nop,nop,TS val 3233053720 ecr 3233053687], length 336
E.....@.@............w.r...&.........x.....
..|...{.:My.Little.Server 901 user user!username@127.0.0.1 :You are now logged out
:SaslServ!saslserv@services.int NOTICE user :Last login from: .r@127.0.0.1. on Jan 24 12:44:24 2026 +0100.
:My.Little.Server 900 user user!username@127.0.0.1 jilles :You are now logged in as jilles
:My.Little.Server 903 user :SASL authentication successful

12:44:25.826428 IP localhost.58332 > localhost.33009: Flags [P.], seq 1844:1885, ack 2329, win 502, options [nop,nop,TS val 3233053737 ecr 3233053720], length 41
E..]ro@.@..)............^.8'.w.......Q.....
..|)..|.:00A SNONOTICE A :Exiting on signal 15.

12:44:25.826439 IP localhost.33009 > localhost.58332: Flags [.], ack 1885, win 502, options [nop,nop,TS val 3233053737 ecr 3233053737], length 0
E..4..@.@.(..............w..^.8P.....(.....
..|)..|)
12:44:25.826466 IP localhost.58332 > localhost.33009: Flags [F.], seq 1885, ack 2329, win 502, options [nop,nop,TS val 3233053737 ecr 3233053737], length 0
E..4rp@.@..Q............^.8P.w.......(.....
..|)..|)
12:44:25.826500 IP localhost.33009 > localhost.58332: Flags [F.], seq 2329, ack 1886, win 502, options [nop,nop,TS val 3233053737 ecr 3233053737], length 0
E..4..@.@.(..............w..^.8Q.....(.....
..|)..|)
12:44:25.826516 IP localhost.58332 > localhost.33009: Flags [.], ack 2330, win 502, options [nop,nop,TS val 3233053737 ecr 3233053737], length 0
E..4rq@.@..P............^.8Q.w.......(.....
..|)..|)
12:44:25.828894 IP localhost.51063 > localhost.39794: Flags [FP.], seq 2662:2728, ack 279, win 512, options [nop,nop,TS val 3233053739 ecr 3233053687], length 66
E..v..@.@............w.r...v.........j.....
..|+..{.ERROR :Closing link: (username@127.0.0.1) [Server shutting down]
```

# Solanum:

```
1769254874.830 1 -> S: AUTHENTICATE PLAIN
1769254876.830 1 -> S: PING synchronize829688.361707314
1769254876.830 S -> 1: AUTHENTICATE +
1769254876.830 S -> 1: :My.Little.Server PONG My.Little.Server :synchronize829688.361707314
1769254876.830 1 -> S: AUTHENTICATE amlsbGVzAGppbGxlcwBzZXNhbWU=
1769254876.868 S -> 1: :My.Little.Server 901 user user!~username@127.0.0.1 :You are now logged out
```

```
12:41:14.829840 IP localhost.37910 > localhost.34679: Flags [P.], seq 183:203, ack 2547, win 639, options [nop,nop,TS val 3232862740 ecr 3232862740], length 20
E..H..@.@.x............w..Q..........<.....
........AUTHENTICATE PLAIN

12:41:14.829864 IP localhost.36283 > localhost.40024: Flags [P.], seq 1346:1426, ack 1077, win 510, options [nop,nop,TS val 3232862740 ecr 3232862697], length 80
E...B.@.@..w...........Xy..X.........x.....
........:42X ENCAP My.Little.Services SASL 42XAAAAAE 00AAAAAAC H 127.0.0.1 127.0.0.1 P

12:41:14.872306 IP localhost.40024 > localhost.36283: Flags [.], ack 1426, win 512, options [nop,nop,TS val 3232862783 ecr 3232862740], length 0
E..4r.@.@............X......y........(.....
...?....
12:41:14.872314 IP localhost.36283 > localhost.40024: Flags [P.], seq 1426:1490, ack 1077, win 510, options [nop,nop,TS val 3232862783 ecr 3232862783], length 64
E..tB.@.@..............Xy............h.....
...?...?:42X ENCAP My.Little.Services SASL 42XAAAAAE 00AAAAAAC S PLAIN

12:41:14.872324 IP localhost.40024 > localhost.36283: Flags [.], ack 1490, win 512, options [nop,nop,TS val 3232862783 ecr 3232862783], length 0
E..4r.@.@............X......y........(.....
...?...?
12:41:14.872359 IP localhost.40024 > localhost.36283: Flags [P.], seq 1077:1135, ack 1490, win 512, options [nop,nop,TS val 3232862783 ecr 3232862783], length 58
E..nr.@.@............X......y........b.....
...?...?:00A ENCAP My.Little.Server SASL 00AAAAAAC 42XAAAAAE C +

12:41:14.872365 IP localhost.36283 > localhost.40024: Flags [.], ack 1135, win 510, options [nop,nop,TS val 3232862783 ecr 3232862783], length 0
E..4B.@.@..............Xy............(.....
...?...?
12:41:14.872403 IP localhost.34679 > localhost.37910: Flags [P.], seq 2547:2563, ack 203, win 512, options [nop,nop,TS val 3232862783 ecr 3232862740], length 16
E..D..@.@............w........Q......8.....
...?....AUTHENTICATE +

12:41:14.916316 IP localhost.37910 > localhost.34679: Flags [.], ack 2563, win 639, options [nop,nop,TS val 3232862827 ecr 3232862783], length 0
E..4..@.@.x............w..Q..........(.....
...k...?
12:41:16.830044 IP localhost.37910 > localhost.34679: Flags [P.], seq 203:237, ack 2563, win 639, options [nop,nop,TS val 3232864740 ecr 3232862783], length 34
E..V..@.@.x............w..Q..........J.....
.......?PING synchronize829688.361707314

12:41:16.830099 IP localhost.34679 > localhost.37910: Flags [P.], seq 2563:2633, ack 237, win 512, options [nop,nop,TS val 3232864740 ecr 3232864740], length 70
E..z..@.@............w........Q......n.....
........:My.Little.Server PONG My.Little.Server :synchronize829688.361707314

12:41:16.830106 IP localhost.37910 > localhost.34679: Flags [.], ack 2633, win 639, options [nop,nop,TS val 3232864740 ecr 3232864740], length 0
E..4..@.@.x............w..Q..........(.....
........
12:41:16.830197 IP localhost.37910 > localhost.34679: Flags [P.], seq 237:280, ack 2633, win 639, options [nop,nop,TS val 3232864740 ecr 3232864740], length 43
E.._..@.@.x............w..Q..........S.....
........AUTHENTICATE amlsbGVzAGppbGxlcwBzZXNhbWU=

12:41:16.830232 IP localhost.36283 > localhost.40024: Flags [P.], seq 1490:1577, ack 1135, win 510, options [nop,nop,TS val 3232864740 ecr 3232862783], length 87
E...B.@.@..m...........Xy..................
.......?:42X ENCAP My.Little.Services SASL 42XAAAAAE 00AAAAAAC C amlsbGVzAGppbGxlcwBzZXNhbWU=

12:41:16.867808 IP localhost.40024 > localhost.36283: Flags [P.], seq 1135:1374, ack 1577, win 512, options [nop,nop,TS val 3232864778 ecr 3232864740], length 239
E..#r.@.@............X......y..?...........
...
....:00A ENCAP * SU 42XAAAAAE
:00AAAAAAC NOTICE 42XAAAAAE :Last login from: .~r@127.0.0.1. on Jan 24 12:41:13 2026 +0100.
:00A ENCAP My.Little.Server SVSLOGIN 42XAAAAAE * * * jilles
:00A ENCAP My.Little.Server SASL 00AAAAAAC 42XAAAAAE D S

12:41:16.867816 IP localhost.36283 > localhost.40024: Flags [.], ack 1374, win 509, options [nop,nop,TS val 3232864778 ecr 3232864778], length 0
E..4B.@.@..............Xy..?.........(.....
...
...

12:41:16.867863 IP localhost.34679 > localhost.37910: Flags [P.], seq 2633:2710, ack 280, win 512, options [nop,nop,TS val 3232864778 ecr 3232864740], length 77
E.....@.@............w........R......u.....
...
....:My.Little.Server 901 user user!~username@127.0.0.1 :You are now logged out

12:41:16.867902 IP localhost.36283 > localhost.40024: Flags [P.], seq 1577:1639, ack 1374, win 509, options [nop,nop,TS val 3232864778 ecr 3232864778], length 62
E..rB.@.@..............Xy..?.........f.....
...
...
:42XAAAAAE SIGNON user ~username 127.0.0.1 1769254873 jilles

12:41:16.884481 IP localhost.40024 > localhost.36283: Flags [P.], seq 1374:1411, ack 1639, win 512, options [nop,nop,TS val 3232864795 ecr 3232864778], length 37
E..Yr.@.@............X......y..}.....M.....
.......
:00A WALLOPS :Exiting on signal 15.

12:41:16.884512 IP localhost.40024 > localhost.36283: Flags [F.], seq 1411, ack 1639, win 512, options [nop,nop,TS val 3232864795 ecr 3232864778], length 0
E..4r.@.@............X......y..}.....(.....
.......

12:41:16.884575 IP localhost.36283 > localhost.40024: Flags [F.], seq 1639, ack 1412, win 509, options [nop,nop,TS val 3232864795 ecr 3232864795], length 0
E..4C.@.@..............Xy..}.........(.....
........
12:41:16.884591 IP localhost.40024 > localhost.36283: Flags [.], ack 1640, win 512, options [nop,nop,TS val 3232864795 ecr 3232864795], length 0
E..4r.@.@............X......y..~.....(.....
........
12:41:16.889950 IP localhost.34679 > localhost.37910: Flags [FP.], seq 2710:3041, ack 280, win 512, options [nop,nop,TS val 3232864800 ecr 3232864740], length 331
E.....@.@............w.....j..R......s.....
... ....:SaslServ!saslserv@services.int NOTICE user :Last login from: .~r@127.0.0.1. on Jan 24 12:41:13 2026 +0100.
:My.Little.Server 900 user user!~username@127.0.0.1 jilles :You are now logged in as jilles
:My.Little.Server 903 user :SASL authentication successful
:My.Little.Server NOTICE user :Server Terminating. Received SIGTERM
```

# UnrealIRCd

```
1769255179.684 1 -> S: AUTHENTICATE PLAIN
1769255181.685 1 -> S: PING synchronize829993.216326409
1769255181.685 S -> 1: AUTHENTICATE +
1769255181.685 S -> 1: :My.Little.Server PONG My.Little.Server :synchronize829993.216326409
1769255181.685 1 -> S: AUTHENTICATE amlsbGVzAGppbGxlcwBzZXNhbWU=
1769255181.732 S -> 1: :My.Little.Server 901 user user!~username@localhost :You are now logged out.
1769255181.732 S -> 1: :SaslServ!saslserv@services.int NOTICE user :Last login from: ~r@localhost on Jan 24 12:46:20 2026 +0100.
1769255181.732 S -> 1: :My.Little.Server 900 user user!~username@localhost jilles :You are now logged in as jilles.
1769255181.732 S -> 1: :My.Little.Server 903 user :SASL authentication successful
```

```
12:46:19.684458 IP localhost.38846 > localhost.43137: Flags [P.], seq 199:219, ack 3007, win 669, options [nop,nop,TS val 3233167595 ecr 3233167595], length 20
E..HQ.@.@..*............?Rc.>0.......<.....
..8...8.AUTHENTICATE PLAIN

12:46:19.684499 IP localhost.34395 > localhost.55468: Flags [P.], seq 6726:6862, ack 1055, win 512, options [nop,nop,TS val 3233167595 ecr 3233167551], length 136
E....;@.@............[..0.!...^............
..8...8.:My.Little.Server SASL My.Little.Services 001BBX106 H 127.0.0.1 127.0.0.1
:My.Little.Server SASL My.Little.Services 001BBX106 S PLAIN

12:46:19.684533 IP localhost.55468 > localhost.34395: Flags [P.], seq 1055:1095, ack 6862, win 861, options [nop,nop,TS val 3233167595 ecr 3233167595], length 40
E..\..@.@.i............[..^.0."z...].P.....
..8...8.:SaslServ SASL 001BBX106 001BBX106 C +

12:46:19.684539 IP localhost.34395 > localhost.55468: Flags [.], ack 1095, win 512, options [nop,nop,TS val 3233167595 ecr 3233167595], length 0
E..4.<@.@............[..0."z..^......(.....
..8...8.
12:46:19.684561 IP localhost.43137 > localhost.38846: Flags [P.], seq 3007:3023, ack 219, win 512, options [nop,nop,TS val 3233167595 ecr 3233167595], length 16
E..D..@.@...............>0..?Rd......8.....
..8...8.AUTHENTICATE +

12:46:19.728306 IP localhost.38846 > localhost.43137: Flags [.], ack 3023, win 669, options [nop,nop,TS val 3233167639 ecr 3233167595], length 0
E..4Q.@.@..=............?Rd.>0.......(.....
..9...8.
12:46:21.684654 IP localhost.38846 > localhost.43137: Flags [P.], seq 219:253, ack 3023, win 669, options [nop,nop,TS val 3233169595 ecr 3233167595], length 34
E..VQ.@.@...............?Rd.>0.......J.....
..@...8.PING synchronize829993.216326409

12:46:21.684724 IP localhost.43137 > localhost.38846: Flags [P.], seq 3023:3093, ack 253, win 512, options [nop,nop,TS val 3233169595 ecr 3233169595], length 70
E..z..@.@...............>0..?Rd4.....n.....
..@...@.:My.Little.Server PONG My.Little.Server :synchronize829993.216326409

12:46:21.684730 IP localhost.38846 > localhost.43137: Flags [.], ack 3093, win 669, options [nop,nop,TS val 3233169595 ecr 3233169595], length 0
E..4Q.@.@..;............?Rd4>0.=.....(.....
..@...@.
12:46:21.684808 IP localhost.38846 > localhost.43137: Flags [P.], seq 253:296, ack 3093, win 669, options [nop,nop,TS val 3233169595 ecr 3233169595], length 43
E.._Q.@.@...............?Rd4>0.=.....S.....
..@...@.AUTHENTICATE amlsbGVzAGppbGxlcwBzZXNhbWU=

12:46:21.684868 IP localhost.34395 > localhost.55468: Flags [P.], seq 6862:6946, ack 1095, win 512, options [nop,nop,TS val 3233169595 ecr 3233167595], length 84
E....=@.@..0.........[..0."z..^......|.....
..@...8.:My.Little.Server SASL My.Little.Services 001BBX106 C amlsbGVzAGppbGxlcwBzZXNhbWU=

12:46:21.728326 IP localhost.55468 > localhost.34395: Flags [.], ack 6946, win 861, options [nop,nop,TS val 3233169639 ecr 3233169595], length 0
E..4..@.@.i=...........[..^.0."....].(.....
..@...@.
12:46:21.728332 IP localhost.43137 > localhost.38846: Flags [.], ack 296, win 512, options [nop,nop,TS val 3233169639 ecr 3233169595], length 0
E..4..@.@...............>0.=?Rd_.....(.....
..@...@.
12:46:21.731593 IP localhost.55468 > localhost.34395: Flags [P.], seq 1095:1307, ack 6946, win 861, options [nop,nop,TS val 3233169642 ecr 3233169595], length 212
E.....@.@.hh...........[..^.0."....].......
..@...@.:nickserv SVS2MODE user -r+d 0
:00AAAAAAC NOTICE 001BBX106 :Last login from: .~r@localhost. on Jan 24 12:46:20 2026 +0100.
:SaslServ SVSLOGIN 001BBX106 001BBX106 jilles
:SaslServ SASL 001BBX106 001BBX106 D S

12:46:21.731602 IP localhost.34395 > localhost.55468: Flags [.], ack 1307, win 511, options [nop,nop,TS val 3233169642 ecr 3233169642], length 0
E..4.>@.@............[..0."..._}.....(.....
..@...@.
12:46:21.731691 IP localhost.43137 > localhost.38846: Flags [P.], seq 3093:3434, ack 296, win 512, options [nop,nop,TS val 3233169642 ecr 3233169595], length 341
E.....@.@..o............>0.=?Rd_.....}.....
..@...@.:My.Little.Server 901 user user!~username@localhost :You are now logged out.
:SaslServ!saslserv@services.int NOTICE user :Last login from: .~r@localhost. on Jan 24 12:46:20 2026 +0100.
:My.Little.Server 900 user user!~username@localhost jilles :You are now logged in as jilles.
:My.Little.Server 903 user :SASL authentication successful

12:46:21.757612 IP localhost.55468 > localhost.34395: Flags [P.], seq 1307:1344, ack 6946, win 861, options [nop,nop,TS val 3233169668 ecr 3233169642], length 37
E..Y..@.@.i............[.._}0."....].M.....
..A...@.:00A GLOBOPS :Exiting on signal 15.

12:46:21.757623 IP localhost.34395 > localhost.55468: Flags [.], ack 1344, win 511, options [nop,nop,TS val 3233169668 ecr 3233169668], length 0
E..4.?@.@............[..0."..._......(.....
..A...A.
12:46:21.757645 IP localhost.55468 > localhost.34395: Flags [F.], seq 1344, ack 6946, win 861, options [nop,nop,TS val 3233169668 ecr 3233169668], length 0
E..4..@.@.i:...........[.._.0."....].(.....
..A...A.
12:46:21.762417 IP localhost.34395 > localhost.55468: Flags [F.], seq 6946, ack 1345, win 512, options [nop,nop,TS val 3233169673 ecr 3233169668], length 0
E..4.@@.@............[..0."..._......(.....
..A	..A.
12:46:21.762431 IP localhost.55468 > localhost.34395: Flags [.], ack 6947, win 861, options [nop,nop,TS val 3233169673 ecr 3233169673], length 0
E..4..@.@.i9...........[.._.0."....].(.....
..A	..A	
12:46:21.762443 IP localhost.43137 > localhost.38846: Flags [F.], seq 3434, ack 296, win 512, options [nop,nop,TS val 3233169673 ecr 3233169595], length 0
E..4..@.@...............>0..?Rd_.....(.....
..A	..@.
12:46:21.762446 IP localhost.38846 > localhost.43137: Flags [.], ack 3435, win 678, options [nop,nop,TS val 3233169673 ecr 3233169642], length 0
E..4Q.@.@..9............?Rd_>0.......(.....
..A	..@.
12:46:21.766780 IP localhost.38846 > localhost.43137: Flags [F.], seq 296, ack 3435, win 678, options [nop,nop,TS val 3233169677 ecr 3233169642], length 0
E..4Q.@.@..8............?Rd_>0.......(.....
..A...@.
12:46:21.766790 IP localhost.43137 > localhost.38846: Flags [.], ack 297, win 512, options [nop,nop,TS val 3233169677 ecr 3233169677], length 0
E..4..@.@.<.............>0..?Rd`....U|.....
..A...A
```
